Index,Name of Influencer,Platform,Date of Apology,Video Title,Link to post,text_apologies,Comments,Original/Repost
15,JonTron Lost Videos,YouTube,"Mar 19, 2017",My Statement: - JonTron (HD) (youtube.com),https://www.youtube.com/watch?v=krOOThz3fJg,well this certainly has been an interesting week so recently as you may have heard I had a public debate about some contentious topics relevant to the day I blew up in the media and they wrote some how you say charitable articles on me so I feel like I need to come out and say something saying silence doesn't really feel right so I'm just going to address this here and now I understand that I wasn't prepared for a debate of this sort with these kinds of sensitive topics at hand adequately you know I was a bit all over the place and I said a lot of stuff that could be misconstrued in all sorts of ways think things are being extracted from this that I know I don't think yeah I was in there under a lot of pressure that I'm not used to being under and as it became clear I suck at debate so now every haphazard offhand remark I made in the heat of the moment is being dissected and speculated on so I like to clarify I was trying to speak to the increasing tribal ovations of our culture these days were taught to think in explicitly racial or ethnic categories or in terms of gender or sexual orientation and I think there's an excel plays a big hand in what's got in our country to the volatile state that is in the simple point I was trying to make is that it's hypocritical for those who see everything in terms of race to suddenly turn around and object when white people speak up in what they believe are the best interests of their race and it's also hypocritical to keep saying you want to have an honest conversation about race if you don't actually want to have an honest conversation about race and anytime someone brings up an uncomfortable statistic you freak out and burn things down or something and I mean you can see this and all the countless media articles that get pumped out every day from the highest level saying for instance you can't be racist against white people or it's a good thing whites are going to become a minority or you see it on TV when someone is mainstream is samantha bee says white people ruined America for voting Trump it's pretty clear who ruined America white people I suppose you could get the reaction if Samantha bee said black people ruined America for voting overwhelmingly for Barack Obama which they did both times I'm not saying that's true but the same standard applies the point I was trying to make Albion and delicately is that you can't banging the racial category drum and then be surprised and shocked when people think in racial categories and just for the sake of total clarity I do completely understand that historically the african-american community has had a raw deal in this country discrimination certainly exists but I do believe it goes always I'm not naive to the fact that we as a country have had a terrible history of dealing with race I mean of course from slavery to Jim Crow to even the Irish but the point is that this kind of discrimination is universally wrong and I feel like for some reason we're regressing on this front pointing at a race and saying all of this race is blank is racist and I have to be honest I don't see many people losing their jobs over this kind of garbage and I'd like to make it clear I have no problem with immigration when it's handled correctly I should have made a career I was mostly speaking to mass immigration I am literally a child of two immigrants it would be pretty famous of me to say that immigration is impossible because it's not you know I brought all this stuff up off hand in a random twitch stream late at night so I understand why people looking at this think I'm some sort of explicit ethno nationalist but but I'm not I genuinely believe this country would be better off if we drop the hyphens and just all refer to each other as fellow Americans and for a number of years now it's been disheartening to me to see this strange road we've been headed down I'd really don't understand it and you know you know some of these topics have really been weighing on me so I felt compelled to respond in some way perhaps against my better judgment I know people don't expect these things from me so in summary you know I'm sorry if this has come out of left field some of you I hope this is cleared up at least a little bit if you were curious what was going on you know any of the things in the stream that could be considered weird sounding or off-putting I probably agree with you that they were so I hope you don't read too much into it that said I genuinely help people keep debating keep talking to each other and keep learning honest civil discourse without which humps is the only way we're getting out of this mess I'd prefer to take a step back now return to doing comedy it's what I do better anyway thank you sincerely to all of you who have supported me through this through this ride I really appreciate it if you'd like to catch up on my new videos you know what if I you,On,Repost
16,DaddyOFive Founders,Youtube,"Apr 25, 2017",[REUPLOAD]DaddyOFive Founders Issue Public Apology,https://www.youtube.com/watch?v=gG47IKxh8B8&list=PLqkz-pvmNGHOl3Kw_quVf3v9PyNH4cTJL&index=23,and to see what we've done and to see how we've come across and I understand how everyone feels I acknowledge and and I respect how everyone feels about this and I do agree that we put things on the internet that should not be there we did things that we should not do and as a mother over the last week looking back at the videos and just thinking about things if I didn't know the people and I saw some of those things I would be thinking the same thing I would be like oh my god those poor children once people started watching us and you know the kids got excited about it and they would try to see how many views they could get and we feel like we went from something that wasn't so bad and and then we just kept going more and more for the shock factor versus reality and to see what could get more views and they kind of feel like some of it's their fault and it's not their fault it's it's not it's were their parents and we should have made better decisions we could give them a whole lot more than we could give them before and we just felt like we were doing the best thing that we could for we are now in family counseling because we need it not only to get through the you know media stuff but we we need it to come back together and have everybody even the kids to understand what we did wrong in all this we just want to give our kids back to some type of normalcy we just want them to be able to go back to school and just live their lives I just wanted to take care of everybody I just want you just wanted you guys we wanted them to be happy we just wanted our kids to be happy we went about it the wrong way we're focused there on making sure that our kids don't have to deal with so much backlash from our bad decisions and we realize now what kind of a situation we put them in and we're just really sorry to them,On,Repost
17,Jake Paul,YouTube,"Jun 4, 2017","Dear YouTube, I'm sorry....",https://www.youtube.com/watch?v=C45-1rf65PU,I hate making these videos but It's like so necessary and again like these daily vlogs Are my LIFE and... how I feel... Aaaand I feel BAD. (Lit intro music) (Huh) SHHHHHH!!! Okay guys My friend Chance who you guys know One of his worst fears in life is getting YEEZY busted for wearing fake Yeezy's. So there's this account on Instagram called Yeezybusta That posts people who were fake Yeezy's and they expose people. Chance has like all real Yeezy's but this is still like a huge fear of his and he's sleeping right now. So I got these hella fake like look how fake these are. I got these hella fake Yeezy's and I'm gonna set them next to him while he's sleeping. Take a picture with them and then send it to my friend @Yeezybusta. And they're gonna post it and we are going to see Chance's reaction. I think he's gonna freak out. (Oooh Ooh!) *Whispers* Chance Smile What bro? Nothing You good bro? *Hysterical Laugh* Nothing's going on bro I already got what I needed. I'm just gonna take these No. No! That's not cool *Laugh* That's not cool Let's make a deal. Let's do it to Tony. Where is he? He's in Tessa's room. He's in Tessa's room? Yeah. I'll do whatever it takes. That's like your worst fear He's scared of it though too right? Yeah bro. Everyone is nobody wants to get Yeezy busted. Alright let's get Tony. I'm gonna get them both. How you doin'? I got you these bro Dope bro. I love--- I love uh What do you love? I love you Why are you looking at my uh my hand? I don't know bro. What's in your pocket? It's my phone Is there a problem with that? You about to take a picture of me? Alright cool. You'll see that on Yeezybusta later OOOOOOHHHHHHH!! Throw me up there bro all- Yoo haha He said all publicity is good publicity True I would know. OOOH! You were like I thought the world was falling on me HEH huhhhhhh.... Is Chance dumb bro? He didn't make me delete the picture. I'm about to Yeezy bust BOTH of them now Alright so I just sent them both to Yeezybusta He's gonna post them now Chance is gonna be so salty. He thought he got away but NOOO! So as you can see his name is Yeezybusta And he just posts everyone like celebrities and people who wear fake Yeezy's. And I think he's about to post Anthony and Chance Bro first of all Welcome back I'm back!! He's back! Did ya miss him? They can't respond Tomorrow we'll see if they missed me In the comments Well I missed you Jake Paulers that's for sure Aww Kade But yo do you know what I'm doing right now? No what's up? I took a picture of these fake Yeezy's with Chance and Anthony While they were sleeping I sent it to Yeezybusta and he's about to post it Not Yeezybusta. Bro if Yeezybusta posts someone with fake Yeezy's you done. Your street cred all your cred is done. This is like--- You never want this to happen OHHHH Oh my God oh my God. Oh my God! Wait oh no no no no. Oh! With fufu OG 750s OH MY GOSHHH!! We got @imanthonytruj and @imchancesutton both with fufu OG 750s. Straps laces and toebox are all completely off. #doublebusted It's like them exposed OH MY GOSH Oh this is so funny. Dude there done They're done. They're done. They can never come back. They can never come back. This is the worst. This is like thing where you do not ever want in your life. They're gonna DM a girl on Instagram and she's gonna be like.... wait aren't you the guy from the Yeezy bust? I saw you on fake YEEZY BUSTA! Oh no thank you. Ight I'm gonna go show them. And the best part Chance was like let's just get Anthony. I was like yeah yeah. And he didn't make me delete the pictures So now I get em You guys got posted by a big profile CONGRATULATIONS! Yoo! Yo congrats Congrats bro. Congrats bro. You're getting posted by like theme accounts and stuff bro You got reposted by the Yeezybusta did you see this? Do you want me to read the caption? Yo that's so fake I was never holding them. No no no. There's a picture of it right here. It says we got Anthony Truj and Chance Sutton both with fufu OG 750s I mean I like to get reposted by big accounts but but that's not one I want to be on. Ah damn. It's pretty bad right? How many followers this dude got? What do you mean? You know about this account? I just don't know how many followers he has It's not about how many it's about the type of people that follow him. Yeah I know they're all- we're all only talking about is Yeezybusta. Noooo! You don't even know what you've done. You can never DM a girl ever again You guys are f*** heads Martinez twins are next AHHH! Oh you thought it was photoshopped It's real? Bro he thought it was photoshopped You're f*cked bro Oh that's why you weren't reacting cuz you thought it- we photoshopped Social suicide man Damn bro Good luck with everything Your guy's bedroom looks uh a lot worse since I was last here What's going on bro? There's just so many girls it's hard to keep it clean Two air mattresses. Oh you got the double air mattress going The double air mattress is that more comfortable? They have that in Spain or what? Yeah yeah The top bunk's storage He said the top bunks' storage and there's nothing on top Yo you guys are so ratchet like yall need help and Jesus mainly Jesus Chance are these real now? Cuz now I got more questions. Oh look at what came with it! Oh my god! God bless this room Dr. Phill please bless these men you need opera Bro congrats. You made it dude You got reposted by a big account man You got Yeezy busted That's lit Do you just don't care? Nah I got the real ones in the closet The internet doesn't think so Kade what's up bro Good to see you man You win some you lose some I guess Like lose some girls You can't win them all it's okay That's such a bad attitude to have about life You want me to be upset about it? It already happened There's nothing I can do about it Your no fun for Youtube Why is he in Tessa's room? Oh sh*t He's right behind me Yo we made it bro I DM'ed him Haha What'd you say? (Laughs) I just said you BASTARD. I'm looking on all the other fake people like Damn he GOT EM! And I was like BRO! He got us!! Good morning Jake Paulers! It has been a GREAT morning already! I hope you're working hard. I HOPE YOU'RE SMILIN! I hope you're dabbing on them HATERS!!! As always..... When the haters come for you.... Just dab on em BABY! If you're new here Im JAKE PAUL! This is the TEAM 10 HOUSE! AND IT IS LIT EVERY SINGLE DAY BRUH! LET'S DO THIS THANNGGGGG! (LIT MUSIC) Sub to Sofia Productions #alwaysplug :),On,Original
18,PewDiePie,YouTube,"Sep 12, 2017",My Response,https://www.youtube.com/watch?v=cLdxuaxaQwc,Hello. I uh wanted to make a statement on what I said in my previous live-stream You probably won't believe me when I say this but whenever I go online and I hear other players use the same kind of language that I did I always find it extremely immature and stupid and I hate how I now personally fed into that part of gaming as well. It was something that I said in the heat of the moment. I said the worst word I could possibly think of. And it just sort of slipped out. And I'm not gonna make any excuses as to why it did Because there are no excuses for it. I'm disappointed in myself because It seems like I've learned nothing from all these past controversies. And it's not that i think I can say or do whatever I want and get away with it. That's not it at all. I'm just an idiot. But that doesn't make what I said or how I said it okay It was not okay. I'm really sorry if I offended hurt or disappointed anyone with all of this. Being in the position I am I should know better. I know I can't keep messing up like this. And I owe it to my audience and to myself to do better than this because I know I'm better than this. I really want to improve myself and better myself Not just for me but for anyone that looks up to me. Or anyone that's influenced by me. And that's how I want to move forward away from this. That's all I had to say. Thank you for watching. Bye.,On,Original
19,Kevin Spacey,X,"Oct 30, 2017",,https://x.com/KevinSpacey/status/924848412842971136,I have a lot of respect and admiration for Anthony Rapp as an actor. I'm beyond horrified to hear his story. I honestly do not remember the encounter it would have been over 30 years ago. But if I did behave then as he describes I owe him the sincerest apology for what would have been deeply inappropriate drunken behavior and I am sorry for the feelings he describes having carried with him all these years. This story has encouraged me to address other things about my life. I know that there are stories out there about me and that some have been fueled by the fact that I have been so protective of my privacy. As those closest to me know in my life I have had relationships with both men and women. I have loved and had romantic encounters with men throughout my life and I choose now to live as a gay man. I want to deal with this honestly and openly and that starts with examining my own behavior. - Kevin Spacey,On,Original
