Index,Name of Influencer,Platform,Date of Apology,Video Title,Link to post,text_apologies,Comments,Original/Repost
0,FineBros,YouTube,2016,Fine Bros apology (REUPLOAD),https://www.youtube.com/watch?v=HoLSOba3_UE&t=4s,hey everybody this video is US wanting to explain some things about react World the confusion and negative response over what this all is has been so overwhelming and what we've realized is that we completely screwed up with how we originally talked about this first and foremost we're sorry for confusing people by using terminology like our react format we were never trying to say that every video or someone reacts to something else is something we would try to control when we referenced licensing the react format we only meant our specific series not the overall genre of reaction videos we do not own the genre and we're creators at heart and those who know us personally know how passionate we are about trying to help creators and react World is meant to be an extension of that with us simply providing resources and tools to anyone who wants to go down this path of creating one of our series with direct support from us so there's no way to go into all of the questions that people have about this but we're going to answer some of the biggest ones that we've seen Okay so first is what exactly constitutes any of your series formats and the simple answer is watch any of our series that is part of the react World license and that is the exact format it's not one or two elements it's all of the elements of the show all used in the same style and way we've been trying to find an analogy to explain this better and we know that this isn't the best but if you wanted to start a fast food restaurant you can start one on your own and possibly find huge success but if you love Burger King and want to be part of that organization if you join you'd be able to get access to things like menu items and recipes and specific logos and promotional support and these are two totally different routes same kind of thing here with react World you can join and get all these assets and support or you can make your own reaction videos completely without us it's up to you okay so another question is have you applied for any trademarks yes we have trademarks just like other companies that use trademarks to protect their properties so for example we have a YouTube channel youtube.com/ react so we're trying to protect it and not run the risk of losing our channel name thanks to someone else getting the trademark but just because we have or might get trademarks doesn't mean we're going to run around and start taking down videos and the last thing we're going to talk about is if there has ever been a situation where we had to take down someone's video yes and look when you create series and products sometimes there is specific situations where your content is being infringed like if someone freeb booots a video on Facebook or in very rare cases if someone produces a beat bybe version of your exact series which has happened to us but again with this one and all of these it's very very complex and we also know that there's so many more questions that you guys have and we want to do our best to answer as many of them as possible so we've set up an email that we will be personally checking if you want more clarification so please write us at ask the Fine Bros at gmail.com for our viewers who are not really part of this conversation and just here to watch our videos thanks for sticking with us through this and for everyone else we want to continue the conversation but either way we just wanted to thank everyone for hearing us out,On,Repost
1,Johnny Depp and Amber Heard,YouTube,2016,Johnny Depp & Amber Heard apologise for illegally bringing dogs to Australia,https://www.youtube.com/watch?v=Q2BDtdkyxFk&t=8s,Australia is a wonderful island with a treasure Trove of unique plants animals and people it has to be protected Australia is free of many pests and diseases that are common place around the world that is why Australia has to have such strong biocurity laws and Australians are just as unique both warm and direct when you disrespect Australian law they will tell you firmly I am truly sorry that pistol and boo were not declared protect in Australia is important declare everything when you enter Australia with that result Johnny thank you thank you you go here you go,On,Repost
2,Tmart'n,YouTube,2016,TmarTn I'm Sorry [REUPLOAD] TmarTn & Syndicate CsGo Lotto Scam | Apology video [DELETED VIDEO] (youtube.com),https://www.youtube.com/watch?v=rSk87Rj1Q34,Cooper I have no idea how I'm gonna record this video dude alright guys so well I'm gonna try to make this as short and sweet as possible I don't want to take up too much of your time but first and foremost I do want to say that I love you guys you guys seriously mean the world to me you have for the past six years that I've been on YouTube and you honestly have changed my life like every single day I get to wake up and chase my dreams and follow my passions and that's all been made possible by you guys so thank you guys for everything that you've done for me and all the opportunities and memories that you've allowed me to create now my connection to csgo lotto has been a matter of public record since the company was first organized in December of 2015 however I do feel like I owe you guys an apology I am sorry to each and every one of you who felt like that was not made clear enough to you and I truly honestly hope that you guys give me an opportunity to earn your trust back please also know that I am committed to making sure that my youtube channel as well as all of my other businesses are in compliance with the law this is why I do not condone minors under the age of 18 to use csgo lotto this is and always has been a clearly stated policy available both in the Terms of Service as well as the initial signup page on the website I've seen a lot of people focusing on the under the age of 13 section of our privacy policy all this section states is that we do not knowingly record information of children under the age of 13 years old in compliance with the Coppa Act this has nothing to do with and does not mean that we condone minors under the age of 18 to play on the site also and this is very important to me I believe that every game offered on CSKA lotto has been legitimate and I am committed to making sure that that remains true again you guys seriously mean the world to me like you changed my life in so many ways on ever be able to thank you for what you all have done thank you guys so much for all the support over the years and I'm just I'm so grateful for each and every one of you from the bottom of my heart so thank you guys for watching I truly do appreciate it I look forward to getting back to my regularly scheduled content and I hope to see you guys there thanks guys,On,Repost
3,James Charles,YouTube,2019,James Charles Tati re-upload,https://www.youtube.com/watch?v=U3Ukl4l_LM8,Oh James here um I'm currently traveling abroad and just woke up but I wanted to sit down and make a video addressing all everything that's going on right now because they've over memory I owe everybody an explanation but most importantly I owe two important people an apology to tatiane James Westbrook I'm sorry for everything that is going on everything that I have put you through over the past few weeks I met Tati and James almost three years ago now but I was first coming into the industry and when I had no friends and nobody to talk to or look up to and Tati very quickly took on a parental role with me because she knew my parents were across the country and over the past few years of knowing her family her husband have given me so much love and advice and opportunities and a place to stay and a shoulder to cry on at in the morning and support when nobody else would or wanted to and it and I'm so disappointed in myself that I ruined our relationship with that did mean so much to me even if I didn't to the best job of shutting it all the time and throughout all of this what sucks the most is that I know there's nothing I can say or do to ever earn that friendship or trust back but I don't blame them for it a lot of my most of my career over the past few years has been about me making mistakes and trying to learn and grow from them and I haven't always done the best job of that I can admit that but I have always tried because I know there's a lot of people watching me and that a lot of people look up to me as a role model and I hate knowing that I disappointed not only them but most importantly to people that have been role models to me doing this I wish that I could say this is the last time that I would make a mistake but it won't be I know that'll disappoint people more and more as I continue to learn and grow every single day I have a long way to go very a long way to go but that's okay um I'm gonna keep trying my best and keep learning and growing and be the best version of me that I possibly can be I'm sorry for that in regards to the Coachella situation with the brand deal on the security guard I've already told my truth about this twice and instead of talking about it for a third time and explaining it and going into detail and pulling up receipts it doesn't matter and I'm I understand that no matter what I say or do they're always going to be people that don't believe me and will think that I'm lying that's okay at this point the truth really does not matter it's the feelings that do and no matter what happened I heard two very very important people and they've been really really loyal to me and I betrayed that know sucks and I wish more than anything that I could take it back in regards to the boy situation I've been involved a lot of very unique and strange situations that have left people confused or upset and I've learned the hard way about ways that I can interact with boys that I'm interested in and also ones that I should or shouldn't be talking to this is a conversation that I know a lot of people are uncomfortable with and it's something that I should have been far more careful with bringing into the public eye especially with the lot of situation that just happened I've had to learn it the hard way but coincidentally enough Tati really was one of the people to sit me down and tell me how it looked from the outside and let me know hey talking to these boys might get you in trouble one day and she was right in regards to my own mother well I know you want to defend me and fight for me and go off on comments but I ask that you don't this is my problem that I got myself into and this is my job to deal with this no matter what is anybody is saying or commenting or talking about mom I need you to know that you're the most important person in my life and think you're an amazing mother and I don't know what I would do without you and I'm so grateful for everything that you've done for me and the lessons that you have taught me and that everything that you continue to do for me and my brother and I need you to know that I need you to know that and the same thing goes for Tati as well who is an amazing person and truly does want the best for everybody around her I'm so disappointed to myself that I her um a lot of times when I've had to address things in the past I've acted out of impulse and I've gone off and tried to pull receipts or facts or screenshots and play the victim and I'm not doing that today No that is I have to say I'm sorry,On,Repost
4,Jenna Marbles,YouTube,2020,Jenna Marbles Apology,https://www.youtube.com/watch?v=679d-SQfWLk,all right so I get it feel like we're at a time where we are purging ourselves of anything and everything toxic and I'm being requested that I address things that I've done in my past I also get a lot of tweets from people that are saying like we love you you unproblematic Queen which always makes me uncomfortable because I'm a person those of you that are familiar with how long I've been on the internet know that that's not true that I've definitely done things in the past that weren't great and I'm not completely unproblematic and I've tried my best to grow up and to be a better person and first and foremost I want everyone to know that I've always been a two-way street and that anytime that you criticize me and tell me that you would like me to do better or to do something differently that I always try to do that and I try to make fun content inclusive content things that don't offend people or upset people and that's kind of where I am there's a couple things that people want me to address and apologize for and I'm happy to do that because what I want from the people that I support and that I like is to have accountability and to know that I'm supporting someone whose morals and values align with my own and yeah I there's things in my past I'm not proud of and I'm getting a lot of tweets from people saying why have you private adalah zone videos and I have spent a lot of the last few days private e almost all of my old content and I'm sorry if any of that holds any nostalgia for you but I'm literally not trying to put out negative things into the world I think there was a time when having all of my old content exists on the internet showed how much I have grown up as a person which I'm very proud of and I think now it's hard for that content to exist at all because I think people watch it and don't bother to look at when it was posted or you know care about what path I took to get to where I am it offends them now and if that's the case where people will watch something and be offended now I don't want it to exist so I private it a lot of my old content because I just don't want anyone to feel upset about anything I I don't want to contribute to that I don't want I don't care I don't care I just don't care I don't want someone to watch something and feel hurt or offended now for any reason at all the first two things that I would like to address is the fact that there are people that were offended that I did blackface as Nicki Minaj in 2011 and I'll show you the clip credibly crazy and embarrassing this is private it has been private for quite some time but it looks like this and I do just want to tell you that it was not my intention to do blackface this is the end of the video where I took my wig off I I don't know how else to say this but it doesn't matter because all that matters is that people were offended and it hurt them and for that I am so unbelievably sorry that this isn't okay and it hasn't existed on the internet for a long time because it's not okay and I haven't done anything remotely like that because I heard people say this is blackface and I don't like that and I I just would never want to put that into the so this has been private for a long time but I do want to tell you how unbelievably sorry I am if I ever offended you by posting this video or by doing this impression and that that was never my intention it's not okay it's shameful it's awful I wish it wasn't part of my past the next thing that I want to address okay this is also from 2011 a bad year for me in judgment apparently um this video is called bounce that dick this has also been made private I don't want to offend anyone I'm not interested in it I'm not interested in making anyone feel bad in case you haven't noticed here's a clip I won't play it for you hold on let me remind you so as you can see I said hey ching chong Ling Wong shake your King Kong ding dong that was racist I'm bad at rap songs it's awful it doesn't need to exist it's inexcusable it's not okay I'm I'm incredibly sorry if this offended you then now whenever it doesn't need to exist it shouldn't have existed I shouldn't have said that ever it's not cool it's not cute it's not okay and I'm embarrassed that I ever made that period I think say how like to apologize for is a video that I posted in 2012 and made private shortly thereafter this was one of the hardest years of my life and I made video they came across unbelievably slut-shaming and I'm sorry I I just [ __ ] up I ranted about girls that ran around and slept around and that's wrong I had a lot of internalized misogyny I feel like at that time in my life and I'm sorry if I ever offended you with the things that I said in that video that there has been private for a long time it does not reflect my attitude towards anyone in their bodies and I just I that's really been eating me up inside for a long time and I just wanted to tell you that I'm sorry if I ever made you feel bad about yourself or your choices or anything there's no one demanding an apology uh for that video of me right now but I'm like just you know what put it on my tab here's another thing I'm sorry for it I'm also sorry for I used to make a lot of content about like what girls do and what guys do and I know at the time there are a lot of people that enjoyed those videos but I have private adalah cause I don't think that making jokes about your gender is funny and I know that there's a lot of people that struggle with their identity and that have varying fluid identities or anything and I just don't want content in the world that's like I don't know it just doesn't make sense you know it doesn't make sense it can be hurtful can be harmful and I don't want it there another thing I would like to address is when people tweet at me I can't believe you be friends with this person or follow this person that's racist or you know done these terrible things and the only thing I would like to say is that I'm I'm just a person trying to navigate the world the same way that you are so I don't always know what's right what's wrong with the truth is and I'm just trying my best if someone clearly with their own pasts but they're not proud of um I do just try to see people for who they are right now today and that they're not defined by their pasts and I understand I'm trying to do the same thing that you are and support and be friends of people that I'm proud of and that I love and I'm just know that I'm doing my best and I just I don't know you know I try to just do what I can and I'm not trying to let anyone down or hurt anyone or upset anyone I'm just not that being said I've profited a lot of metal content um I don't I don't want to hurt anyone I don't want to offend anyone I don't um case you guys haven't noticed there's no sponsors on this channel not trying to sell you anything like I'm literally just here to have a good time and I don't think I'm having a good time and it seems like maybe some other people aren't having a good time so for now I don't I just can't exist on this channel hopefully I've taken down anything that would upset someone and I hope you know that that's just not my intent that's not what I ever set out to do to hurt anyone's feelings or to make anyone feel bad um so I'm just I don't I don't want to be like upset well I say this so give me a sec so um I think I'm just going to move on from this channel for now um I don't know if that's rubber I don't know how long it's gonna be um I just I want to make sure that the things that I put into the world are not hurting anyone and yeah I'm just gonna stop for now wherever I don't know I'll probably take this video down because it's embarrassing and just let whatever just live and just be that's it I want to say thank you for your support for those of you that um care about me and have been watching me for a long time I appreciate it I want to hold myself accountable and and it's painful to do it and it's not fun at first and I'm ashamed of things I've done and said in my past but it's important and yeah I hope this felt like something that you needed to hear from me and I just I'm not sure that I want to continue doing stuff on this channel and I don't want to put anything out in the world it's gotta hurt anybody so I need to be done with this channel for now or forever I don't know so alright good talk see you guys,On,Repost
5,Vanessa Hudgens,YouTube,2020,Vanessa Hudgens Apologizes for Insensitive Coronavirus Comments | E! News,https://www.youtube.com/watch?v=T_JP6FGeFFU,Vanessa Hudgens apologizes for downplaying coronavirus hey guys so yesterday I did an Instagram live and I realized today that some of my comments are being taken out of context it's a crazy time it's a crazy crazy time and I am at home and in lockdown and that's what I hope you guys are doing - in full quarantine and staying safe and sane yeah I don't take the situation lightly by any means I am home yeah trust was criticized after posting an Instagram live video in which he made insensitive comments about the deadly pandemic even if everybody gets it like yeah people are gonna die terrible but like inevitable she immediately thought twice about her comments comments were met with backlash prompting the High School Musical star to issue an apology she writes hey guys I'm so sorry for the way I've offended anyone and everyone who has seen the clip from my Instagram live yesterday I realize my words were insensitive and not at all appropriate for the situation our country and the world are in right now there has been a huge wake-up about the significance my words have now more than ever I'm sending safe wishes to everyone to stay safe and healthy during this crazy time so stay inside y'all,On,Repost
